{
  "antetSatirlari": ["T.C.", "ACME BELEDİYE BAŞKANLIĞI"],
  "kurumUst": "T.C. ACME BELEDİYE BAŞKANLIĞI",
  "kurumAdi": "Acme Belediyesi",
  "mudurluk": "Fen İşleri Müdürlüğü",
  "belgeBasligi": "TEKLİF MEKTUBU DAĞITIM ÇİZELGESİ",
  "isAdi": "Belediyemize ait Yeni Mahalle Mahallesinde yapımı devam etmekte olan Düğün Salonunun Çatı yapımında kullanılmak üzere malzeme alımı 3",
  "satirlar": [
    {
      "sira": 1
    },
    {
      "sira": 2
    },
    {
      "sira": 3
    },
    {
      "sira": 4
    },
    {
      "sira": 5
    },
    {
      "sira": 6
    }
  ],
  "kalemSayisi": 5,
  "kalemSayisiYazi": "beş",
  "vtarih": "06/05/2026",
  "baskanAdi": "İSMET SARI",
  "baskanUnvan": "Belediye Başkanı",
  "komisyon": [
    {
      "gorev": "Komisyon Başkanı",
      "adSoyad": "Mustafa ER",
      "unvan": "Memur"
    },
    {
      "gorev": "Komisyon Üyesi",
      "adSoyad": "Hasan ALİ",
      "unvan": "Tekniker"
    },
    {
      "gorev": "Komisyon Üyesi",
      "adSoyad": "AYDIN ACAR",
      "unvan": "Tekniker"
    },
    {
      "gorev": "Komisyon Üyesi",
      "adSoyad": "Mehmet DEMİR",
      "unvan": "Memur"
    }
  ],
  "solLogo": "https://raw.githubusercontent.com/ilyasbozdemir/workdesk-360/main/public/icon.png",
  "sagLogo": "https://upload.wikimedia.org/wikipedia/commons/0/0f/Logo_of_100th_years_of_the_Republic_of_T%C3%BCrkiye.svg"
}
