{
  "antetSatirlari": [
    "T.C.",
    "SAĞLIK BAKANLIĞI",
    "Ankara İl Sağlık Müdürlüğü",
    "Destek Hizmetleri Başkanlığı"
  ],
  "kurumUst": "T.C. SAĞLIK BAKANLIĞI",
  "kurumAdi": "Ankara İl Sağlık Müdürlüğü",
  "mudurluk": "Destek Hizmetleri Başkanlığı",
  "belgeBasligi": "PİYASA FİYAT ARAŞTIRMASI MEKTUBU DAĞITIM ÇİZELGESİ",
  "isAdi": "Tıbbi Sarf Malzeme Alımı İşi",
  "satirlar": [
    {
      "sira": 1
    },
    {
      "sira": 2
    },
    {
      "sira": 3
    },
    {
      "sira": 4
    },
    {
      "sira": 5
    }
  ],
  "kalemSayisi": 15,
  "kalemSayisiYazi": "on beş",
  "vtarih": "21.06.2026",
  "baskanAdi": "Dr. Ahmet Yılmaz",
  "baskanUnvan": "Destek Hizmetleri Başkanı",
  "komisyon": [
    {
      "gorev": "Komisyon Üyesi",
      "adSoyad": "Mehmet Kaya",
      "unvan": "Mühendis"
    },
    {
      "gorev": "Komisyon Üyesi",
      "adSoyad": "Ayşe Demir",
      "unvan": "Biyolog"
    },
    {
      "gorev": "Komisyon Üyesi",
      "adSoyad": "Hasan Şahin",
      "unvan": "Sağlık Memuru"
    }
  ],
  "solLogo": "https://raw.githubusercontent.com/ilyasbozdemir/workdesk-360/main/public/icon.png",
  "sagLogo": "https://upload.wikimedia.org/wikipedia/commons/0/0f/Logo_of_100th_years_of_the_Republic_of_T%C3%BCrkiye.svg"
}
